{"schemaVersion":2,"contract":"paper-cost","requestId":"request-synthetic","asOf":"2026-10-14T08:00:00+00:00","data":{"costId":"cost-synthetic","walletId":"wallet-synthetic","economicEventId":"cost-event-synthetic","kind":"commission","assetId":"asset-usdt-synthetic","amount":"1.25","occurredAtUtc":"2026-10-14T08:00:00+00:00","knownAtUtc":"2026-10-14T08:00:00+00:00","publicationSequence":2,"rootCostId":"cost-synthetic","revision":1,"replacesCostId":null,"correctionReason":null,"reason":"Manual synthetic commission","recordedByUserId":"user-synthetic","replacedByCostId":null,"reversalEconomicEventId":null,"source":"userDeclaredPaperCost","ledgerPolicyVersion":"paper-wallet-cost-ledger-v1","costCoverage":"unknown"},"publicationWatermark":2,"snapshotCursor":"synthetic-cost-snapshot","streamRevision":2}
